table,name,valueType,unit,repeatable,label,variableNameRegexp,variableValueRegexp
core,snacks_sch,decimal,times/day,0,Snacking frequency per day,,
core,fastfood_sch,decimal,times/week,0,Visiting fast food restaurant,,
core,supp_pgn,integer,numeric,0,Supplements during pregnancy,,
core,supp_psc,integer,numeric,0,Supplements in preschool age,,
core,supp_sch,integer,numeric,0,Supplements in school-age children,,
core,recruit_age,integer,days,0,"Age of the child at time of enrolment. In days. Negative if prepartum, positive if postpartum",,
core,cats_preg,integer,numeric,0,Cat ownership during pregnancy,,
core,cats_quant_preg,integer,cats,0,Number of cats owned during pregnancy,,
core,dogs_preg,integer,numeric,0, Dog ownership during pregnancy,,
core,dogs_quant_preg,integer,dogs,0,Number of dogs owned during pregnancy,,
core,prepreg_dep,integer,numeric,0,Maternal history of depressive disorders,,
core,prepreg_anx,integer,numeric,0,Maternal history of anxiety disorders,,
core,prepreg_ed,integer,numeric,0,Maternal history of any eating disorder,,
core,preg_ed,integer,numeric,0,Maternal any eating disorder active during the index pregnancy,,
core,prepreg_an,integer,numeric,0,Maternal history of anorexia nervosa,,
core,preg_an,integer,numeric,0,Maternal anorexia nervosa active during the index pregnancy,,
core,prepreg_bn,integer,numeric,0,Maternal history of bulimia nervosa ,,
core,preg_bn,integer,numeric,0,Maternal bulimia nervosa active during the index pregnancy,,
core,abroad_mo,integer,numeric,0,Mother's born abroad,,
core,abroad_fa,integer,numeric,0,Father's born abroad,,
core,abroad_child,integer,numeric,0,Child's born abroad,,
core,age_years,integer,numeric,1,Age of child in years,,
core,age_months,integer,numeric,1,Age of child in months,,
core,height_,decimal,cm,1,Height of the child,,
core,height_age,integer,days,1,Age of the child at height measurement,,
core,weight_,decimal,kg,1,Weight of the child,,
core,weight_age,integer,days,1,Age of the child at weight measurement,,
core,cohab_,integer,numeric,1,Cohabitation status ,,
core,occup_m_,integer,numeric,1,Maternal occupational status ,,
core,occupcode_m_,integer,numeric,1,Maternal occupational code,,
core,edu_m_,integer,numeric,1,Maternal eduction ,,
core,occup_f1_,integer,numeric,1,"Paternal occupational status, primary father ",,
core,occup_f1_fath,integer,numeric,1,Father type for occup_f1_,,
core,occup_f2_,integer,numeric,1,"Paternal occupational status, secondary father ",,
core,occup_f2_fath,integer,numeric,1,Father type for occup_f2_,,
core,occupcode_f1_,integer,numeric,1,Primary father's occupational code,,
core,occupcode_f1_fath,integer,numeric,1,Father type for occupcode_f1_,,
core,occupcode_f2_,integer,numeric,1,Secondary father's occupational code,,
core,occupcode_f2_fath,integer,numeric,1,Father type for occupcode_f2_,,
core,edu_f1_,integer,numeric,1,Primary father figure's education level,,
core,edu_f1_fath,integer,numeric,1,Type of father for edu_f1_,,
core,edu_f2_,integer,numeric,1,Secondary father figure's education level ,,
core,edu_f2_fath,integer,numeric,1,Type of father for edu_f2_,,
core,childcare_,integer,numeric,1,Child cared for by care givers other than parents,,
core,childcarerel_,integer,numeric,1,Child cared for by relatives/friends/nanny/babysitter/au pair,,
core,childcareprof_,integer,numeric,1,Child cared for by a child care professional,,
core,childcarecentre_,integer,numeric,1,Child attending a day care centre,,
core,smk_exp,integer,numeric,1,Exposure to passive smoke,,
core,pets_,integer,numeric,1,Furry pet ownership,,
core,cats_,integer,numeric,1,Cat ownership,,
core,cats_quant_,integer,cats,1,Quantity of cats owned,,
core,dogs_,integer,numeric,1,Dog ownership,,
core,dogs_quant_,integer,dogs,1,Quantity of dogs owned,,
core,mental_exp,integer,numeric,1,Mental disorder exposure ,,
core,hhincome_,integer,numeric,1,Total yearly income of the household ,,
core,fam_splitup,integer,numeric,1,Parent split up ,,
core,famsize_child,integer,numeric,1,"Family size at birth, children ",,
core,famsize_adult,integer,numeric,1,"Family size at birth, adults ",,
core,no2_,decimal,micrograms_per_cubic_meter,1,no2 average value (extrapolated back in time using ratio method),,
core,nox_,decimal,micrograms_per_cubic_meter,1,nox average value (extrapolated back in time using ratio method),,
core,pm10_,decimal,micrograms_per_cubic_meter,1,pm10 average value (extrapolated back in time using ratio method),,
core,pm25_,decimal,micrograms_per_cubic_meter,1,pm25 average value (extrapolated back in time using ratio method),,
core,pmcoarse_,decimal,micrograms_per_cubic_meter,1,pmcoarse average value (extrapolated back in time using ratio method),,
core,pm25abs_,decimal,ten_power_minus_five_per_inverse_meter,1,pm25abs average value (extrapolated back in time using ratio method),,
core,pm25cu_,decimal,micrograms_per_cubic_meter,1,pm25cu value,,
core,pm25fe_,decimal,micrograms_per_cubic_meter,1,pm25fe value,,
core,pm25k_,decimal,micrograms_per_cubic_meter,1,pm25k value,,
core,pm25ni_,decimal,micrograms_per_cubic_meter,1,pm25ni value,,
core,pm25s_,decimal,micrograms_per_cubic_meter,1,pm25s value,,
core,pm25si_,decimal,micrograms_per_cubic_meter,1,pm25si value,,
core,pm25v_,decimal,micrograms_per_cubic_meter,1,pm25v value,,
core,pm25zn_,decimal,micrograms_per_cubic_meter,1,pm25zn value,,
core,pm10cu_,decimal,micrograms_per_cubic_meter,1,pm10cu value,,
core,pm10fe_,decimal,micrograms_per_cubic_meter,1,pm10fe value,,
core,pm10k_,decimal,micrograms_per_cubic_meter,1,pm10k value,,
core,pm10ni_,decimal,micrograms_per_cubic_meter,1,pm10ni value,,
core,pm10s_,decimal,micrograms_per_cubic_meter,1,pm10s value,,
core,pm10si_,decimal,micrograms_per_cubic_meter,1,pm10si value,,
core,pm10v_,decimal,micrograms_per_cubic_meter,1,pm10v value,,
core,pm10zn_,decimal,micrograms_per_cubic_meter,1,pm10zn value,,
core,popdens_,decimal,people_per_square_kilometer,1,population density,,
core,bdens100_,decimal,square_meter_per_square_kilometer,1,building density within a buffer of 100 m,,
core,bdens300_,decimal,square_meter_per_square_kilometer,1,building density within a buffer of 300 m,,
core,connind100_,decimal,number_per_square_kilometer,1,connectivity density within a buffer of 100 m,,
core,connind300_,decimal,number_per_square_kilometer,1,connectivity density within a buffer of 300 m,,
core,bus_lines_100_,decimal,meter_per_square_kilometer,1,length of public bus lines within a buffer of 100 m,,
core,bus_lines_300_,decimal,meter_per_square_kilometer,1,length of public bus lines within a buffer of 300 m,,
core,bus_lines_500_,decimal,meter_per_square_kilometer,1,length of public bus lines within a buffer of 500 m,,
core,bus_stops_100_,decimal,number_per_square_kilometer,1,number of public bus stops within a buffer of 100 m,,
core,bus_stops_300_,decimal,number_per_square_kilometer,1,number of public bus stops within a buffer of 100 m,,
core,bus_stops_500_,decimal,number_per_square_kilometer,1,number of public bus stops within a buffer of 500 m,,
core,fdensity300_,decimal,number_per_square_kilometer,1,number of facilities present within a buffer of 300 m,,
core,frichness300_,decimal,,1,number of different facility types present divided by the maximum potential number of facility types within a buffer of 300 m,,
core,landuseshan300_,decimal,,1,landuse Shannon's Evenness Index within a buffer of 300 m,,
core,walkability_mean_,decimal,numeric,1,"walkability index (as mean of deciles of facility richness index, landuse shannon's Evenness Index, population density, connectivity density) within a buffer of 300 m",,
core,agrgr_,decimal,percent,1,"percentage of agrgr (agricultural areas, semi-natural areas and wetlands) land use within a buffer of 300 m",,
core,airpt_,decimal,percent,1,percentage of airpt (airports) land use within a buffer of 300 m,,
core,hdres_,decimal,percent,1,percentage of hdres (continuous urban fabric) land use within a buffer of 300 m,,
core,indtr_,decimal,percent,1,"percentage of indtr (industrial, commercial, public, military and private units) land use within a buffer of 300 m",,
core,ldres_,decimal,percent,1,percentage of ldres (discontinuous dense/medium density/low density urban fabric) land use within a buffer of 300 m,,
core,natgr_,decimal,percent,1,percentage of natgr (forests) land use within a buffer of 300 m,,
core,other_,decimal,percent,1,"percentage of other (mineral extraction and dump sites, construction sites, land without current use) land use within a buffer of 300 m",,
core,port_,decimal,percent,1,percentage of port (port areas) land use within a buffer of 300 m,,
core,trans_,decimal,percent,1,"percentage of trans (road and rail network and associated land, fast transit roads and associated land, other roads and associated land, railways and associated land) land use within a buffer of 300 m",,
core,urbgr_,decimal,percent,1,"percentage of urbgr (green urban areas, sports and leisure facilities) land use within a buffer of 300 m",,
core,vldres_,decimal,percent,1,percentage of vldres (discontinuous very low density urban fabric) land use within a buffer of 300 m,,
core,water_,decimal,percent,1,percentage of water land use within a buffer of 300 m,,
core,blue_dist_,decimal,meter,1," straight line distance to nearest blue space > 5,000 m2",,
core,green_dist_,decimal,meter,1," straight line distance to nearest green space > 5,000 m2",,
core,blue_size_,decimal,square_meter,1," area of closest blue space > 5,000m2",,
core,green_size_,decimal,square_meter,1," area of closest green space > 5,000m2",,
core,blueyn300_,integer,numeric,1," is there a blue space  > 5,000 m2 in a distance of 300 m?",,
core,greenyn300_,integer,numeric,1," is there a green space  > 5,000 m2 in a distance of 300 m?",,
core,ndvi100_,decimal,ndvi_value,1,average of NDVI values within a buffer of 100 m,,
core,ndvi300_,decimal,ndvi_value,1,average of NDVI values within a buffer of 300 m,,
core,ndvi500_,decimal,ndvi_value,1,average of NDVI values within a buffer of 500 m,,
core,lden_,decimal,A_weighted_decibel,1,day-evening-night level,,
core,ln_,decimal,A_weighted_decibel,1,night level,,
core,lden_c_,integer,numeric,1,categorized day-evening-night level,,
core,ln_c_,integer,numeric,1,categorized night level,,
core,noise_dist_,decimal,meter,1,straight distance to the nearest road with noise level,,
core,areases_tert_,integer,numeric,1,area-level SES indicator (deprivation index in tertiles),,
core,areases_quint_,integer,numeric,1,area-level SES indicator (deprivation index in quintiles),,
core,distinvnear1_,decimal,inverse_meter,1,inverse distance to nearest road,,
core,trafload100_,decimal,vehicles_per_day_and_meter,1,total traffic load of all roads within a buffer of 100 m,,
core,trafmajorload100_,decimal,vehicles_per_day_and_meter,1,total traffic load of major roads within a buffer of 100 m,,
core,trafnear_,decimal,vehicles_per_day,1,traffic density on nearest road,,
core,foodenvdens300_,decimal,number_per_square_kilometer,1,number of facilities related to unhealthy food divided by the area of the 300 meters buffer,,
core,foodenvdensosm300_,decimal,number_per_square_kilometer,1,number of open street maps facilities related to unhealthy food divided by the area of the 300 meters buffer,,
core,tm_,decimal,degree_celsius,1,average of mean temperature,,
core,tmin_,decimal,degree_celsius,1,average of minimum temperature,,
core,tmax_,decimal,degree_celsius,1,average of maximum temperature,,
core,hum_,decimal,percent,1,average of mean relative humidity,,
core,hmin_,decimal,percent,1,average of minimum relative humidity,,
core,hmax_,decimal,percent,1,average of maximum relative humidity,,
core,uvddc_,decimal,kilojoules_per_square_meter,1,average of DNA-damage UV dose,,
core,uvdec_,decimal,kilojoules_per_square_meter,1,average of erythemal UV dose,,
core,uvdvc_,decimal,kilojoules_per_square_meter,1,average of vitamin-d UV dose,,
core,lst_,decimal,degree_celsius,1,land surface temperature,,
core,mdist_,decimal,meter,1,distance to meteorological station,,
core,ed_m_,integer,numeric,1,Maternal any eating disorder active after the index pregnancy,,
core,an_m_,integer,numeric,1,Maternal anorexia nervosa active after the index pregnancy,,
core,bn_m_,integer,numeric,1,Maternal bulimia nervosa active after the index pregnancy,,
core,age_trimester,integer,numeric,1,Age of the child in trimesters,,
core,smk_t,integer,numeric,1,Smoking,,
core,alc_t,integer,numeric,1,Any alcohol intake,,
core,no2_t,decimal,micrograms_per_cubic_meter,1,no2 average value (extrapolated back in time using ratio method),,
core,nox_t,decimal,micrograms_per_cubic_meter,1,nox average value (extrapolated back in time using ratio method),,
core,pm10_t,decimal,micrograms_per_cubic_meter,1,pm10 average value (extrapolated back in time using ratio method),,
core,pm25_t,decimal,micrograms_per_cubic_meter,1,pm25 average value (extrapolated back in time using ratio method),,
core,pmcoarse_t,decimal,micrograms_per_cubic_meter,1,pmcoarse average value (extrapolated back in time using ratio method),,
core,pm25abs_t,decimal,ten_power_minus_five_per_inverse_meter,1,pm25abs average value (extrapolated back in time using ratio method),,
core,pm25cu_t,decimal,nanograms_per_cubic_meter,1,pm25cu value,,
core,pm25fe_t,decimal,nanograms_per_cubic_meter,1,pm25fe value,,
core,pm25k_t,decimal,nanograms_per_cubic_meter,1,pm25k value,,
core,pm25ni_t,decimal,nanograms_per_cubic_meter,1,pm25ni value,,
core,pm25s_t,decimal,nanograms_per_cubic_meter,1,pm25s value,,
core,pm25si_t,decimal,nanograms_per_cubic_meter,1,pm25si value,,
core,pm25v_t,decimal,nanograms_per_cubic_meter,1,pm25v value,,
core,pm25zn_t,decimal,nanograms_per_cubic_meter,1,pm25zn value,,
core,pm10cu_t,decimal,nanograms_per_cubic_meter,1,pm10cu value,,
core,pm10fe_t,decimal,nanograms_per_cubic_meter,1,pm10fe value,,
core,pm10k_t,decimal,nanograms_per_cubic_meter,1,pm10k value,,
core,pm10ni_t,decimal,nanograms_per_cubic_meter,1,pm10ni value,,
core,pm10s_t,decimal,nanograms_per_cubic_meter,1,pm10s value,,
core,pm10si_t,decimal,nanograms_per_cubic_meter,1,pm10si value,,
core,pm10v_t,decimal,nanograms_per_cubic_meter,1,pm10v value,,
core,pm10zn_t,decimal,nanograms_per_cubic_meter,1,pm10zn value,,
core,popdens_t,decimal,people_per_square_kilometer,1,population density,,
core,bdens100_t,decimal,square_meter_per_square_kilometer,1,building density within a buffer of 100 m,,
core,bdens300_t,decimal,square_meter_per_square_kilometer,1,building density within a buffer of 300 m,,
core,connind100_t,decimal,number_per_square_kilometer,1,connectivity density within a buffer of 100 m,,
core,connind300_t,decimal,number_per_square_kilometer,1,connectivity density within a buffer of 300 m,,
core,bus_lines_100_t,decimal,meter_per_square_kilometer,1,length of public bus lines within a buffer of 100 m,,
core,bus_lines_300_t,decimal,meter_per_square_kilometer,1,length of public bus lines within a buffer of 300 m,,
core,bus_lines_500_t,decimal,meter_per_square_kilometer,1,length of public bus lines within a buffer of 500 m,,
core,bus_stops_100_t,decimal,number_per_square_kilometer,1,number of public bus stops within a buffer of 100 m,,
core,bus_stops_300_t,decimal,number_per_square_kilometer,1,number of public bus stops within a buffer of 300 m,,
core,bus_stops_500_t,decimal,number_per_square_kilometer,1,number of public bus stops within a buffer of 500 m,,
core,fdensity300_t,decimal,number_per_square_kilometer,1,number of facilities present within a buffer of 300 m,,
core,frichness300_t,decimal,numeric,1,number of different facility types present divided by the maximum potential number of facility types within a buffer of 300 m,,
core,landuseshan300_t,decimal,numeric,1,landuse Shannon's Evenness Index within a buffer of 300 m,,
core,walkability_mean_t,decimal,numeric,1,"walkability index (as mean of deciles of facility richness index, landuse shannon's Evenness Index, population density, connectivity density) within a buffer of 300 m",,
core,agrgr_t,decimal,percent,1,"percentage of agrgr (agricultural areas, semi-natural areas and wetlands) land use within a buffer of 300 m",,
core,airpt_t,decimal,percent,1,percentage of airpt (airports) land use within a buffer of 300 m,,
core,hdres_t,decimal,percent,1,percentage of hdres (continuous urban fabric) land use within a buffer of 300 m,,
core,indtr_t,decimal,percent,1,"percentage of indtr (industrial, commercial, public, military and private units) land use within a buffer of 300 m",,
core,ldres_t,decimal,percent,1,percentage of ldres (discontinuous dense/medium density/low density urban fabric) land use within a buffer of 300 m,,
core,natgr_t,decimal,percent,1,percentage of natgr (forests) land use within a buffer of 300 m,,
core,other_t,decimal,percent,1,"percentage of other (mineral extraction and dump sites, construction sites, land without current use) land use within a buffer of 300 m",,
core,port_t,decimal,percent,1,percentage of port (port areas) land use within a buffer of 300 m,,
core,trans_t,decimal,percent,1,"percentage of trans (road and rail network and associated land, fast transit roads and associated land, other roads and associated land, railways and associated land) land use within a buffer of 300 m",,
core,urbgr_t,decimal,percent,1,"percentage of urbgr (green urban areas, sports and leisure facilities) land use within a buffer of 300 m",,
core,vldres_t,decimal,percent,1,percentage of vldres (discontinuous very low density urban fabric) land use within a buffer of 300 m,,
core,water_t,decimal,percent,1,percentage of water land use within a buffer of 300 m,,
core,blue_dist_t,decimal,meter,1," straight line distance to nearest blue space > 5,000 m2",,
core,green_dist_t,decimal,meter,1," straight line distance to nearest green space > 5,000 m2",,
core,blue_size_t,decimal,square_meter,1," area of closest blue space > 5,000m2",,
core,green_size_t,decimal,square_meter,1," area of closest green space > 5,000m2",,
core,blueyn300_t,integer,numeric,1," is there a blue space  > 5,000 m2 in a distance of 300 m?",,
core,greenyn300_t,integer,numeric,1," is there a green space  > 5,000 m2 in a distance of 300 m?",,
core,ndvi100_t,decimal,ndvi_value,1,average of NDVI values within a buffer of 100 m,,
core,ndvi300_t,decimal,ndvi_value,1,average of NDVI values within a buffer of 300 m,,
core,ndvi500_t,decimal,ndvi_value,1,average of NDVI values within a buffer of 500 m,,
core,lden_t,decimal,A_weighted_decibel,1,day-evening-night level,,
core,ln_t,decimal,A_weighted_decibel,1,night level,,
core,lden_c_t,integer,numeric,1,categorized day-evening-night level,,
core,ln_c_t,integer,numeric,1,categorized night level,,
core,noise_dist_t,decimal,meter,1,straight distance to the nearest road with noise level,,
core,areases_tert_t,integer,numeric,1,area-level SES indicator (deprivation index in tertiles),,
core,areases_quint_t,integer,numeric,1,area-level SES indicator (deprivation index in quintiles),,
core,distinvnear1_t,decimal,inverse_meter,1,inverse distance to nearest road,,
core,trafload100_t,decimal,vehicles_per_day_and_meter,1,total traffic load of all roads within a buffer of 100 m,,
core,trafmajorload100_t,decimal,vehicles_per_day_and_meter,1,total traffic load of major roads within a buffer of 100 m,,
core,trafnear_t,decimal,vehicles_per_day,1,traffic density on nearest road,,
core,foodenvdens300_t,decimal,number_per_square_kilometer,1,number of facilities related to unhealthy food divided by the area of the 300 meters buffer,,
core,foodenvdensosm300_t,decimal,number_per_square_kilometer,1,number of open street maps facilities related to unhealthy food divided by the area of the 300 meters buffer,,
core,tm_t,decimal,degree_celsius,1,average of mean temperature,,
core,tmin_t,decimal,degree_celsius,1,average of minimum temperature,,
core,tmax_t,decimal,degree_celsius,1,average of maximum temperature,,
core,hum_t,decimal,percent,1,average of mean relative humidity,,
core,hmin_t,decimal,percent,1,average of minimum relative humidity,,
core,hmax_t,decimal,percent,1,average of maximum relative humidity,,
core,uvddc_t,decimal,kilojoules_per_square_meter,1,average of DNA-damage UV dose,,
core,uvdec_t,decimal,kilojoules_per_square_meter,1,average of erythemal UV dose,,
core,uvdvc_t,decimal,kilojoules_per_square_meter,1,average of vitamin-d UV dose,,
core,lst_t,decimal,degree_celsius,1,land surface temperature,,
core,mdist_t,decimal,meter,1,distance to meteorological station,,
core,SAI_score_t,integer,numeric,1,SAI score X trimester,,
core,SCL_total_score_t,integer,numeric,1,SCL score X trimester,,
core,SCL_anx_score_t,integer,numeric,1,SCL anxiety score X trimester,,
core,SCL_dep_score_t,integer,numeric,1,SCL depression score X trimester,,
core,GA_anx_t,integer,numeric,1,Gestational age in days at X trimester anxiety measure,,
